<?xml version="1.0" encoding="UTF-8"?>
<!DOCTYPE saci SYSTEM "file:/Users/jomi/programming/agents/Jason/lib/saci/bin/applications.dtd">
<?xml-stylesheet href="file:/Users/jomi/programming/agents/Jason/lib/saci/bin/applications.xsl" type="text/xsl" ?>
<saci>
<application id="testCent">
<script id="run">

	<killSocietyAgents society.name="testCent" />
	<killFacilitator society.name="testCent" />
	<startSociety society.name="testCent" />

	<killSocietyAgents society.name="testCent-env" />
	<killFacilitator society.name="testCent-env" />
	<startSociety society.name="testCent-env" />

	<startAgent 
		name="environment" 
		society.name="testCent-env" 
		class="myPkg.testEnv" 
		host="localhost" />
	<startAgent 
		name="ag0" 
		society.name="testCent" 
		class="jason.architecture.CentralisedAgArch"
		args="jason.asSemantics.Agent '/Users/jomi/programming/agents/Jason/examples/Simple/./as/ag0.asl'  options synchronized=true,verbose=1"
		qty="1" />
	<startAgent 
		name="ag1" 
		society.name="testCent" 
		class="myPkg.MyAgArch"
		args="myPkg.MyAgClass '/Users/jomi/programming/agents/Jason/examples/Simple/./as/ag1.asl'  options synchronized=true"
		host="localhost" />
	<startAgent 
		name="agCount" 
		society.name="testCent" 
		class="jason.architecture.CentralisedAgArch"
		args="jason.asSemantics.Agent '/Users/jomi/programming/agents/Jason/examples/Simple/agCount.asl'  options synchronized=true"/>
	<startAgent 
		name="controller" 
		society.name="testCent-env" 
		class="jason.control.ExecutionControl" />

</script>
</application>
</saci>
