<?xml version="1.0" encoding="UTF-8"?>
<!DOCTYPE saci SYSTEM "file:/Users/jomi/programming/agents/Jason/bin/../lib/saci/bin/applications.dtd">
<?xml-stylesheet href="file:/Users/jomi/programming/agents/Jason/bin/../lib/saci/bin/applications.xsl" type="text/xsl" ?>
<saci>
<application id="testOWCent">
<script id="run">

	<killSocietyAgents society.name="testOWCent" />
	<killFacilitator society.name="testOWCent" />
	<startSociety society.name="testOWCent" />

	<killSocietyAgents society.name="testOWCent-env" />
	<killFacilitator society.name="testOWCent-env" />
	<startSociety society.name="testOWCent-env" />

	<startAgent 
		name="environment" 
		society.name="testOWCent-env" 
		class="testOWEnv" />
	<startAgent 
		name="tow" 
		society.name="testOWCent" 
		class="jason.architecture.CentralisedAgArch"
		args="jason.asSemantics.Agent '/Users/jomi/programming/agents/Jason/examples/SimpleOpenWorld/tow.asl'  options verbose=3"
		qty="3" />

</script>
</application>
</saci>
